{"capability_trace":[{"arguments":[[{"$rat":["0","1"]},{"$rat":["0","1"]}]],"capability_id":"motion.move2d","result":null}],"emitted_events":[{"arguments":[{"$int":"7"}],"entity_id":"Chain","event_id":"internal"},{"arguments":[{"$int":"7"}],"entity_id":"Chain","event_id":"completed"}],"final_states":[{"entity_id":"Chain","state":{"value":{"type":"Int","value":{"$int":"7"}}}}],"program_hash":"a362d9b7e2850c8327eb0f6a4cbebf949cb6edb82fb493f980a8c5c8c078aea5","receipt_hash":"5fcbd07512192ec298ff18bc313c71418e079e04d303aa3514a49ab91462371d","scenario_id":"event-chain.v1","schema":"TEV_SCRIPT_CONFORMANCE_RECEIPT_V1"}
