{"capability_trace":[{"arguments":[],"capability_id":"time.delta","result":{"$rat":["1","60"]}}],"emitted_events":[{"arguments":[{"$int":"10"},{"$rat":["15","4"]},false,"frontera \u03a9 \ud83d\ude00",[{"$rat":["3","1"]},{"$rat":["-1","12"]}],[{"$rat":["7","2"]},{"$rat":["8","3"]},{"$rat":["10","1"]}]],"entity_id":"Matrix","event_id":"observed"}],"final_states":[{"entity_id":"Matrix","state":{"bool_and":{"type":"Bool","value":false},"bool_eq":{"type":"Bool","value":false},"bool_ge":{"type":"Bool","value":true},"bool_gt":{"type":"Bool","value":true},"bool_le":{"type":"Bool","value":false},"bool_lt":{"type":"Bool","value":false},"bool_ne":{"type":"Bool","value":true},"bool_not":{"type":"Bool","value":true},"bool_or":{"type":"Bool","value":true},"int_minus":{"type":"Int","value":{"$int":"4"}},"int_plus":{"type":"Int","value":{"$int":"10"}},"int_star":{"type":"Int","value":{"$int":"21"}},"int_unary":{"type":"Int","value":{"$int":"-7"}},"max_rat":{"type":"Rat","value":{"$rat":["7","1"]}},"min_int":{"type":"Int","value":{"$int":"3"}},"observed_delta":{"type":"Rat","value":{"$rat":["1","60"]}},"rat_div":{"type":"Rat","value":{"$rat":["15","4"]}},"rat_minus":{"type":"Rat","value":{"$rat":["11","6"]}},"rat_mixed":{"type":"Rat","value":{"$rat":["19","2"]}},"rat_plus":{"type":"Rat","value":{"$rat":["19","6"]}},"rat_star":{"type":"Rat","value":{"$rat":["5","3"]}},"rat_unary":{"type":"Rat","value":{"$rat":["-5","2"]}},"text_value":{"type":"Text","value":"frontera \u03a9 \ud83d\ude00"},"vec2_div":{"type":"Vec2","value":[{"$rat":["1","6"]},{"$rat":["-1","4"]}]},"vec2_minus":{"type":"Vec2","value":[{"$rat":["-1","6"]},{"$rat":["-13","4"]}]},"vec2_plus":{"type":"Vec2","value":[{"$rat":["3","1"]},{"$rat":["-1","12"]}]},"vec2_scaled_left":{"type":"Vec2","value":[{"$rat":["7","2"]},{"$rat":["-21","4"]}]},"vec2_scaled_right":{"type":"Vec2","value":[{"$rat":["1","3"]},{"$rat":["-1","2"]}]},"vec3_value":{"type":"Vec3","value":[{"$rat":["7","2"]},{"$rat":["8","3"]},{"$rat":["10","1"]}]}}}],"program_hash":"899c555b1825e340e53a53ad21aaf7e8fb7a4f7fe53e26f0a66b196515ed2393","receipt_hash":"70df629159b6088aa3807deea217d4cdb06f28a41042aac1f6ebff6332179500","scenario_id":"matrix.full.v1","schema":"TEV_SCRIPT_CONFORMANCE_RECEIPT_V1"}
