{"capability_trace":[{"arguments":["Player ready"],"capability_id":"debug.log","result":null},{"arguments":[],"capability_id":"input.move2d","result":[{"$rat":["1","1"]},{"$rat":["0","1"]}]},{"arguments":[[{"$rat":["5","1"]},{"$rat":["0","1"]}]],"capability_id":"motion.move2d","result":null},{"arguments":["Walk"],"capability_id":"animation.play","result":null}],"emitted_events":[{"arguments":[],"entity_id":"Player","event_id":"died"}],"final_states":[{"entity_id":"Player","state":{"health":{"type":"Int","value":{"$int":"0"}},"speed":{"type":"Rat","value":{"$rat":["5","1"]}}}}],"program_hash":"f18d1b2428b96bf8c859463ab62a431c654933e65e23c3d8183335506d5adb5d","receipt_hash":"b275ccc6530ad84c0f96320ba1c8893b401638a926a99a78479d99fbd3c4aba5","scenario_id":"player.basic.v1","schema":"TEV_SCRIPT_CONFORMANCE_RECEIPT_V1"}
