{"capability_trace":[{"arguments":[],"capability_id":"input.move2d","result":[{"$rat":["0","1"]},{"$rat":["0","1"]}]},{"arguments":[[{"$rat":["0","1"]},{"$rat":["0","1"]}]],"capability_id":"motion.move2d","result":null},{"arguments":["Idle"],"capability_id":"animation.play","result":null}],"emitted_events":[],"final_states":[{"entity_id":"Player","state":{"health":{"type":"Int","value":{"$int":"100"}},"speed":{"type":"Rat","value":{"$rat":["5","1"]}}}}],"program_hash":"f18d1b2428b96bf8c859463ab62a431c654933e65e23c3d8183335506d5adb5d","receipt_hash":"647d3211f7411b88c155d658ba4c9494482378cde75c9f427dc4e38475acd17c","scenario_id":"player.idle.v1","schema":"TEV_SCRIPT_CONFORMANCE_RECEIPT_V1"}
